{
  "$schema": "https://json-schema.org/draft/2020-12/schema",
  "$id": "https://uduck.dev/schema/behavior.schema.json",
  "title": "MicroDuckBehavior",
  "description": "Schema definition for Microduck behavior policies in uDuck Registry",
  "$defs": {
    "nonEmptyString": {
      "type": "string",
      "minLength": 1
    },
    "id": {
      "type": "string",
      "pattern": "^[a-z0-9]+(?:-[a-z0-9]+)*$"
    },
    "semver": {
      "type": "string",
      "pattern": "^\\d+\\.\\d+\\.\\d+(-[a-zA-Z0-9.]+)?$"
    },
    "githubUsername": {
      "type": "string",
      "pattern": "^(?:[A-Za-z0-9]|[A-Za-z0-9][A-Za-z0-9-]{0,37}[A-Za-z0-9])$"
    },
    "httpsUrl": {
      "type": "string",
      "format": "uri",
      "pattern": "^https://[^/@?#]+(?:[/?#].*)?$"
    },
    "artifactUrl": {
      "type": "string",
      "format": "uri",
      "pattern": "^https://(?:huggingface\\.co|raw\\.githubusercontent\\.com)(?:[/?#].*)?$"
    },
    "mediaUrl": {
      "anyOf": [
        {
          "$ref": "#/$defs/httpsUrl"
        },
        {
          "type": "string",
          "pattern": "^/(?!/)(?:[A-Za-z0-9._-]+/)*[A-Za-z0-9._-]+$"
        }
      ]
    },
    "onnxFilename": {
      "type": "string",
      "pattern": "^[A-Za-z0-9][A-Za-z0-9._-]*\\.onnx$"
    }
  },
  "type": "object",
  "additionalProperties": false,
  "required": [
    "id",
    "name",
    "version",
    "description",
    "category",
    "tags",
    "authors",
    "license",
    "verification",
    "contract",
    "compatibility",
    "artifacts",
    "media",
    "sources",
    "deployment"
  ],
  "properties": {
    "id": {
      "$ref": "#/$defs/id",
      "description": "Unique lowercase kebab-case identifier"
    },
    "name": {
      "type": "string",
      "minLength": 2,
      "description": "Display name of the behavior"
    },
    "version": {
      "$ref": "#/$defs/semver",
      "description": "Semantic version"
    },
    "description": {
      "type": "string",
      "minLength": 10,
      "description": "Crisp summary of what the duck does"
    },
    "details": {
      "type": "string",
      "description": "Additional context, training notes, or usage notes"
    },
    "category": {
      "type": "string",
      "enum": [
        "locomotion",
        "agility-tricks",
        "manipulation",
        "recovery",
        "roller-skate",
        "experimental"
      ]
    },
    "tags": {
      "type": "array",
      "items": {
        "$ref": "#/$defs/nonEmptyString"
      },
      "minItems": 1
    },
    "authors": {
      "type": "array",
      "minItems": 1,
      "items": {
        "type": "object",
        "additionalProperties": false,
        "required": ["name"],
        "properties": {
          "name": {
            "$ref": "#/$defs/nonEmptyString"
          },
          "affiliation": {
            "$ref": "#/$defs/nonEmptyString"
          },
          "github": {
            "$ref": "#/$defs/githubUsername"
          },
          "url": {
            "$ref": "#/$defs/httpsUrl"
          }
        }
      }
    },
    "license": {
      "$ref": "#/$defs/nonEmptyString"
    },
    "verification": {
      "type": "object",
      "additionalProperties": false,
      "required": ["status", "summary", "hardware_target"],
      "properties": {
        "status": {
          "type": "string",
          "enum": [
            "verified_hardware",
            "claimed_hardware",
            "community_experimental"
          ]
        },
        "summary": {
          "$ref": "#/$defs/nonEmptyString"
        },
        "hardware_target": {
          "$ref": "#/$defs/nonEmptyString"
        },
        "notes": {
          "$ref": "#/$defs/nonEmptyString"
        }
      }
    },
    "contract": {
      "type": "object",
      "additionalProperties": false,
      "required": [
        "observation_dim",
        "observation_breakdown",
        "action_dim",
        "action_breakdown",
        "control_frequency_hz",
        "decimation",
        "actuator_model",
        "action_scale"
      ],
      "properties": {
        "observation_dim": {
          "type": "integer",
          "const": 61
        },
        "observation_breakdown": {
          "type": "object",
          "additionalProperties": false,
          "required": ["proprioception", "twist", "head_pose", "body_pose"],
          "properties": {
            "proprioception": {
              "type": "integer",
              "const": 48
            },
            "twist": {
              "type": "integer",
              "const": 3
            },
            "head_pose": {
              "type": "integer",
              "const": 4
            },
            "body_pose": {
              "type": "integer",
              "const": 6
            }
          }
        },
        "action_dim": {
          "type": "integer",
          "const": 14
        },
        "action_breakdown": {
          "type": "object",
          "additionalProperties": false,
          "required": ["left_leg", "neck_head", "right_leg"],
          "properties": {
            "left_leg": {
              "type": "integer",
              "const": 5
            },
            "neck_head": {
              "type": "integer",
              "const": 4
            },
            "right_leg": {
              "type": "integer",
              "const": 5
            }
          }
        },
        "control_frequency_hz": {
          "type": "number",
          "const": 50
        },
        "decimation": {
          "type": "integer",
          "minimum": 1
        },
        "actuator_model": {
          "$ref": "#/$defs/nonEmptyString"
        },
        "action_scale": {
          "type": "number"
        }
      }
    },
    "compatibility": {
      "type": "object",
      "additionalProperties": false,
      "required": ["robot_model", "accessories_required", "terrain", "robotd_slot"],
      "properties": {
        "robot_model": {
          "type": "string",
          "enum": ["microduck-standard", "microduck-rollers", "custom-duck"]
        },
        "accessories_required": {
          "type": "array",
          "items": {
            "$ref": "#/$defs/nonEmptyString"
          }
        },
        "terrain": {
          "type": "array",
          "minItems": 1,
          "items": {
            "type": "string",
            "enum": ["flat", "rough", "slope", "any"]
          }
        },
        "robotd_slot": {
          "type": "string",
          "enum": [
            "walk",
            "stand",
            "sitstand",
            "roulade",
            "kick_left",
            "kick_right",
            "ground_pick",
            "roller",
            "custom"
          ]
        }
      }
    },
    "artifacts": {
      "type": "object",
      "additionalProperties": false,
      "required": ["onnx"],
      "properties": {
        "onnx": {
          "type": "object",
          "additionalProperties": false,
          "required": ["filename", "url", "baked_normalizer"],
          "properties": {
            "filename": {
              "$ref": "#/$defs/onnxFilename"
            },
            "url": {
              "$ref": "#/$defs/artifactUrl"
            },
            "baked_normalizer": {
              "type": "boolean"
            }
          }
        },
        "checkpoint": {
          "type": "object",
          "additionalProperties": false,
          "properties": {
            "url": {
              "$ref": "#/$defs/httpsUrl"
            },
            "framework": {
              "$ref": "#/$defs/nonEmptyString"
            }
          }
        },
        "config": {
          "type": "object",
          "additionalProperties": false,
          "properties": {
            "url": {
              "$ref": "#/$defs/httpsUrl"
            }
          }
        }
      }
    },
    "media": {
      "type": "object",
      "additionalProperties": false,
      "required": ["hero_type"],
      "properties": {
        "thumbnail_url": {
          "$ref": "#/$defs/mediaUrl"
        },
        "loop_url": {
          "$ref": "#/$defs/mediaUrl"
        },
        "video_url": {
          "$ref": "#/$defs/mediaUrl"
        },
        "hero_type": {
          "type": "string",
          "enum": ["video", "image", "badge"]
        },
        "caption": {
          "$ref": "#/$defs/nonEmptyString"
        }
      }
    },
    "simulation": {
      "type": "object",
      "additionalProperties": false,
      "description": "Optional CI simulation-check configuration. When omitted, the profile is derived from compatibility.robotd_slot.",
      "properties": {
        "profile": {
          "type": "string",
          "enum": ["velocity", "standing", "sitstand", "oneshot_phase", "oneshot_zero"]
        },
        "duration_s": { "type": "number", "minimum": 1, "maximum": 30 },
        "period_s": { "type": "number", "exclusiveMinimum": 0, "maximum": 30 },
        "end_phase": { "type": "number", "exclusiveMinimum": 0, "maximum": 1 },
        "hold_s": { "type": "number", "minimum": 0, "maximum": 30 },
        "allow_fall": { "type": "boolean" },
        "expect_tracking": { "type": "boolean" },
        "segments": {
          "type": "array",
          "minItems": 1,
          "maxItems": 12,
          "items": {
            "type": "object",
            "additionalProperties": false,
            "required": ["duration_s", "vx", "vy", "wz"],
            "properties": {
              "duration_s": { "type": "number", "exclusiveMinimum": 0, "maximum": 30 },
              "vx": { "type": "number" },
              "vy": { "type": "number" },
              "wz": { "type": "number" }
            }
          }
        }
      }
    },
    "sources": {
      "type": "object",
      "additionalProperties": false,
      "required": ["upstream_repo"],
      "properties": {
        "upstream_repo": {
          "$ref": "#/$defs/httpsUrl"
        },
        "training_code_url": {
          "$ref": "#/$defs/httpsUrl"
        },
        "task_id": {
          "$ref": "#/$defs/nonEmptyString"
        },
        "huggingface_space": {
          "$ref": "#/$defs/httpsUrl"
        },
        "discussion_url": {
          "$ref": "#/$defs/httpsUrl"
        }
      }
    },
    "deployment": {
      "type": "object",
      "additionalProperties": false,
      "required": ["robotd_toml"],
      "properties": {
        "robotd_toml": {
          "$ref": "#/$defs/nonEmptyString"
        }
      }
    }
  }
}
