{
  "id": "genesis-velocity",
  "name": "Genesis Flat Walk",
  "version": "1.0.0",
  "description": "Velocity-tracking walking policy trained in a Genesis port of the Microduck environment for flat terrain.",
  "details": "Macmachi's Genesis port of Pollen's Microduck walking task, with this export trained on flat terrain. The standalone ONNX includes the observation normalizer. No physical robot test is documented.",
  "category": "locomotion",
  "tags": [
    "community",
    "genesis",
    "velocity-tracking",
    "flat-ground",
    "50hz"
  ],
  "authors": [
    {
      "name": "Macmachi",
      "github": "Macmachi",
      "url": "https://github.com/Macmachi"
    }
  ],
  "license": "Apache-2.0",
  "verification": {
    "status": "community_experimental",
    "summary": "Simulation-only export from a community Genesis training port; no physical Microduck test is documented.",
    "hardware_target": "Microduck v1 (14 Dynamixel XL330 servos)",
    "notes": "No physical robot test is documented. This ONNX export declares a dynamic batch axis but preserves the 61-D input and 14-D output contract."
  },
  "contract": {
    "observation_dim": 61,
    "observation_breakdown": {
      "proprioception": 48,
      "twist": 3,
      "head_pose": 4,
      "body_pose": 6
    },
    "action_dim": 14,
    "action_breakdown": {
      "left_leg": 5,
      "neck_head": 4,
      "right_leg": 5
    },
    "control_frequency_hz": 50,
    "decimation": 4,
    "actuator_model": "Dynamixel XL330 (BAM M6 voltage control law)",
    "action_scale": 1.0
  },
  "compatibility": {
    "robot_model": "microduck-standard",
    "accessories_required": [],
    "terrain": [
      "flat"
    ],
    "robotd_slot": "walk"
  },
  "artifacts": {
    "onnx": {
      "filename": "velocity.onnx",
      "url": "https://raw.githubusercontent.com/Macmachi/microduck-rl-genesis/9fa4b270023b8b9b50809fa6dc15a28996f5c724/policies/velocity.onnx",
      "baked_normalizer": true
    }
  },
  "media": {
    "hero_type": "badge",
    "caption": "Community Genesis flat-terrain walking policy"
  },
  "sources": {
    "upstream_repo": "https://github.com/Macmachi/microduck-rl-genesis",
    "training_code_url": "https://github.com/Macmachi/microduck-rl-genesis",
    "task_id": "microduck-velocity"
  },
  "deployment": {
    "robotd_toml": "[policy]\nwalk = \"/opt/robot/policies/velocity.onnx\""
  }
}
