{
  "id": "fall-recovery",
  "name": "Dynamic Fall Recovery",
  "version": "1.0.0",
  "description": "Automatic fall recovery policy capable of restoring Microduck to standing posture from face-down, face-up, or sitting positions.",
  "details": "Triggered automatically when the onboard IMU's projected gravity vector exceeds tilt thresholds (or commanded via gamepad recovery button). The policy executes robust arm-less biped pushups, righting the duck without human intervention before handing off control back to the standing/walking state machine.",
  "category": "recovery",
  "tags": [
    "official",
    "fall-recovery",
    "getup",
    "self-righting",
    "50hz",
    "safety"
  ],
  "authors": [
    {
      "name": "Pollen Robotics",
      "affiliation": "Pollen Robotics / Hugging Face",
      "github": "pollen-robotics",
      "url": "https://pollen-robotics.com"
    }
  ],
  "license": "Apache-2.0",
  "verification": {
    "status": "verified_hardware",
    "summary": "Verified on physical Microduck hardware with fall detection triggers enabled. Robot self-rights after tip-over.",
    "hardware_target": "Microduck v1 (Rockchip RK3566, 14 Dynamixel XL330-M077, 2S LiPo)",
    "notes": "Requires full-body contact handling."
  },
  "contract": {
    "observation_dim": 61,
    "observation_breakdown": {
      "proprioception": 48,
      "twist": 3,
      "head_pose": 4,
      "body_pose": 6
    },
    "action_dim": 14,
    "action_breakdown": {
      "left_leg": 5,
      "neck_head": 4,
      "right_leg": 5
    },
    "control_frequency_hz": 50,
    "decimation": 4,
    "actuator_model": "Dynamixel XL330 (BAM M6 voltage control law)",
    "action_scale": 1
  },
  "compatibility": {
    "robot_model": "microduck-standard",
    "accessories_required": [],
    "terrain": [
      "flat",
      "rough"
    ],
    "robotd_slot": "stand"
  },
  "artifacts": {
    "onnx": {
      "filename": "BEST_alpha_stand.onnx",
      "url": "https://huggingface.co/spaces/pollen-robotics/microduck-simulator/resolve/main/app/public/policies/BEST_alpha_stand.onnx",
      "baked_normalizer": true
    }
  },
  "media": {
    "video_url": "https://pollen-robotics.com/assets/microduck/gallery/balance-recovery.mp4",
    "hero_type": "video",
    "caption": "Microduck pushed over on carpet recovering to standing posture",
    "thumbnail_url": "/media/thumbs/fall-recovery.jpg",
    "loop_url": "/media/loops/fall-recovery.mp4"
  },
  "sources": {
    "upstream_repo": "https://github.com/pollen-robotics/microduck",
    "training_code_url": "https://github.com/pollen-robotics/microduck_rl",
    "task_id": "Mjlab-StandUp-Flat-MicroDuck",
    "huggingface_space": "https://huggingface.co/spaces/pollen-robotics/microduck-simulator"
  },
  "deployment": {
    "robotd_toml": "[policy]\nstand = \"/opt/robot/policies/BEST_alpha_stand.onnx\""
  }
}
