{
  "id": "alpha-walking",
  "name": "Alpha Dynamic Walk",
  "version": "1.0.0",
  "description": "Standard bipedal walking gait with 50 Hz velocity tracking (vx, vy, yaw_rate) and active head-pose orientation control.",
  "details": "The flagship locomotion policy for MicroDuck. Trained in MuJoCo Warp via mjlab and PPO using the BAM M6 actuator model for Dynamixel XL330 servos. Includes domain randomization on battery voltage, friction, and motor command delay. Exports a baked observation normalizer into the ONNX computational graph.",
  "category": "locomotion",
  "tags": [
    "official",
    "bipedal",
    "velocity-tracking",
    "head-control",
    "50hz",
    "flat-ground"
  ],
  "authors": [
    {
      "name": "Pollen Robotics",
      "affiliation": "Pollen Robotics / Hugging Face",
      "github": "pollen-robotics",
      "url": "https://pollen-robotics.com"
    }
  ],
  "license": "Apache-2.0",
  "verification": {
    "status": "verified_hardware",
    "summary": "Verified on physical MicroDuck hardware with Rockchip RK3566 and 14 Dynamixel XL330 servos. Shipped as default walking policy.",
    "hardware_target": "MicroDuck v1 (Rockchip RK3566, 14 Dynamixel XL330-M077, 2S LiPo)",
    "notes": "Operates at 50 Hz control loop. Velocity envelope: -0.2 to +0.25 m/s forward/back, ±1.0 rad/s angular yaw rate."
  },
  "contract": {
    "observation_dim": 61,
    "observation_breakdown": {
      "proprioception": 48,
      "twist": 3,
      "head_pose": 4,
      "body_pose": 6
    },
    "action_dim": 14,
    "action_breakdown": {
      "left_leg": 5,
      "neck_head": 4,
      "right_leg": 5
    },
    "control_frequency_hz": 50,
    "decimation": 4,
    "actuator_model": "Dynamixel XL330 (BAM M6 voltage control law)",
    "action_scale": 1
  },
  "compatibility": {
    "robot_model": "microduck-standard",
    "accessories_required": [],
    "terrain": [
      "flat"
    ],
    "robotd_slot": "walk"
  },
  "artifacts": {
    "onnx": {
      "filename": "BEST_alpha_walking.onnx",
      "url": "https://huggingface.co/spaces/pollen-robotics/microduck-simulator/resolve/main/app/public/policies/BEST_alpha_walking.onnx",
      "baked_normalizer": true
    }
  },
  "media": {
    "video_url": "https://pollen-robotics.com/assets/microduck/moves-portrait-alpha/walk.webm",
    "hero_type": "video",
    "caption": "MicroDuck walking under gamepad velocity control on hardware",
    "thumbnail_url": "/media/thumbs/alpha-walking.jpg",
    "loop_url": "/media/loops/alpha-walking.mp4"
  },
  "sources": {
    "upstream_repo": "https://github.com/pollen-robotics/microduck",
    "training_code_url": "https://github.com/pollen-robotics/microduck_rl",
    "task_id": "Mjlab-Velocity-Flat-MicroDuck",
    "huggingface_space": "https://huggingface.co/spaces/pollen-robotics/microduck-simulator"
  },
  "deployment": {
    "robotd_toml": "[policy]\nwalk = \"/opt/robot/policies/BEST_alpha_walking.onnx\""
  }
}
