{
  "id": "ball-kick-right",
  "name": "Impulse Ball Kick (Right Foot)",
  "version": "1.0.0",
  "description": "One-shot dynamic kick with the right foot designed to strike a 70mm / 15g ball forward while maintaining single-leg biped balance.",
  "details": "Actor is ball-blind (the operator or higher-level vision aims the robot). The runtime hot-swaps this policy for a 0.5-second execution window with command channels zeroed. Runs at standing gain tuning to maintain stance leg stability while the right swing leg delivers an impulse strike.",
  "category": "manipulation",
  "tags": [
    "official",
    "kick",
    "soccer",
    "impulse",
    "single-leg-balance",
    "50hz"
  ],
  "authors": [
    {
      "name": "Pollen Robotics",
      "affiliation": "Pollen Robotics / Hugging Face",
      "github": "pollen-robotics",
      "url": "https://pollen-robotics.com"
    }
  ],
  "license": "Apache-2.0",
  "verification": {
    "status": "verified_hardware",
    "summary": "Verified on physical Microduck hardware kicking a standard 70 mm lightweight practice ball.",
    "hardware_target": "Microduck v1 (Rockchip RK3566, 14 Dynamixel XL330-M077)",
    "notes": "Targeted for 70mm diameter, 15g mass spheres."
  },
  "contract": {
    "observation_dim": 61,
    "observation_breakdown": {
      "proprioception": 48,
      "twist": 3,
      "head_pose": 4,
      "body_pose": 6
    },
    "action_dim": 14,
    "action_breakdown": {
      "left_leg": 5,
      "neck_head": 4,
      "right_leg": 5
    },
    "control_frequency_hz": 50,
    "decimation": 4,
    "actuator_model": "Dynamixel XL330 (BAM M6 voltage control law)",
    "action_scale": 1
  },
  "compatibility": {
    "robot_model": "microduck-standard",
    "accessories_required": [
      "70mm_practice_ball"
    ],
    "terrain": [
      "flat"
    ],
    "robotd_slot": "kick_right"
  },
  "artifacts": {
    "onnx": {
      "filename": "ball_kick_right.onnx",
      "url": "https://huggingface.co/spaces/pollen-robotics/microduck-simulator/resolve/main/app/public/policies/ball_kick_right.onnx",
      "baked_normalizer": true
    }
  },
  "media": {
    "hero_type": "badge",
    "caption": "Microduck right foot impulse kick striking a mini soccer ball"
  },
  "sources": {
    "upstream_repo": "https://github.com/pollen-robotics/microduck",
    "training_code_url": "https://github.com/pollen-robotics/microduck_rl",
    "task_id": "Mjlab-BallKick-Flat-MicroDuck",
    "huggingface_space": "https://huggingface.co/spaces/pollen-robotics/microduck-simulator"
  },
  "deployment": {
    "robotd_toml": "[policy]\nkick_right = \"/opt/robot/policies/ball_kick_right.onnx\""
  }
}
