{
  "id": "rough-walk-g",
  "name": "Rough Walk G",
  "version": "1.0.0",
  "description": "Velocity-commanded walking trained from scratch for small stairs, rubble, and slopes.",
  "details": "A from-scratch rough-terrain gait from the same policy family as rough-walk-e. The publisher reports 12 falls in 110 synchronized trials and survival across both 2 cm stairs and a 9-degree slope, with 17 percent higher flat-ground motor power than alpha-walking. It is simulation-only and has never been tested on hardware.",
  "category": "locomotion",
  "tags": [
    "community",
    "rough-terrain",
    "velocity-tracking",
    "from-scratch",
    "simulation-only",
    "50hz"
  ],
  "authors": [
    {
      "name": "RemiFabre",
      "github": "RemiFabre",
      "url": "https://huggingface.co/RemiFabre"
    }
  ],
  "license": "Apache-2.0",
  "verification": {
    "status": "community_experimental",
    "summary": "Public simulation-only rough-terrain walking export; no physical Microduck deployment evidence is documented.",
    "hardware_target": "Microduck v1 (14 Dynamixel XL330 servos)",
    "notes": "The publisher reports higher motor power and weak turn response compared with alpha-walking. Watch actuator temperature during any future hardware testing."
  },
  "contract": {
    "observation_dim": 61,
    "observation_breakdown": {
      "proprioception": 48,
      "twist": 3,
      "head_pose": 4,
      "body_pose": 6
    },
    "action_dim": 14,
    "action_breakdown": {
      "left_leg": 5,
      "neck_head": 4,
      "right_leg": 5
    },
    "control_frequency_hz": 50,
    "decimation": 4,
    "actuator_model": "Dynamixel XL330 (BAM M6 voltage control law)",
    "action_scale": 1.0
  },
  "compatibility": {
    "robot_model": "microduck-standard",
    "accessories_required": [],
    "terrain": [
      "flat",
      "rough",
      "slope"
    ],
    "robotd_slot": "walk"
  },
  "artifacts": {
    "onnx": {
      "filename": "policy.onnx",
      "url": "https://huggingface.co/RemiFabre/microduck-rough-walk-g/resolve/242876a0aa8b40b702142fb0a5677fd43bc88a4c/policy.onnx",
      "baked_normalizer": true
    }
  },
  "media": {
    "video_url": "https://huggingface.co/RemiFabre/microduck-rough-walk-g/resolve/242876a0aa8b40b702142fb0a5677fd43bc88a4c/media/preview.mp4",
    "hero_type": "video",
    "caption": "Microduck walking across rough terrain in simulation"
  },
  "sources": {
    "upstream_repo": "https://github.com/pollen-robotics/microduck_rl",
    "training_code_url": "https://github.com/pollen-robotics/microduck_rl/commit/6cd45fc7a865299f118f7671142465d377853928",
    "task_id": "Mjlab-Hostile-FinetuneFeetProgress-MicroDuck"
  },
  "deployment": {
    "robotd_toml": "[policy]\nwalk = \"/opt/robot/policies/rough-walk-g/policy.onnx\""
  }
}
